{
  "schema_version": "1.0",
  "brand_id": "gustav",
  "name": "Gustav Online example channel",
  "owner": "Gustav Online",
  "channel_intent": "Turn bounded business context into useful, buyer-relevant systems content.",
  "cadence": {
    "core_videos_per_week": 3,
    "planning_horizon_weeks": 26,
    "useful_short_target": 22,
    "note": "Three core videos per week for 26 weeks is 78 core videos; add 22 useful shorts for a 100-asset planning target."
  },
  "channels": [
    {
      "id": "youtube",
      "enabled": true,
      "reason": "Primary home for approved long-form explanations and selected shorts.",
      "allowed_asset_types": ["long", "short"]
    },
    {
      "id": "linkedin",
      "enabled": true,
      "reason": "Primary professional route for practical proof, context, and buyer learning.",
      "allowed_asset_types": ["text"]
    },
    {
      "id": "instagram",
      "enabled": false,
      "reason": "Optional short route; enable only when the derivative has a clear visual and audience fit.",
      "allowed_asset_types": ["short"]
    },
    {
      "id": "tiktok",
      "enabled": false,
      "reason": "The current buyer/context fit is stronger on YouTube and LinkedIn; do not assume every edit becomes TikTok content.",
      "allowed_asset_types": []
    }
  ]
}
